{
  "contract_version": "strategy_ai_startup_load_contract_v2",
  "startup_trigger": [
    "スタート",
    "起動確認",
    "人格ロード確認",
    "統治ロード確認"
  ],
  "persona_sources": {
    "gpts_load_contract": "https://raw.githubusercontent.com/yoshi07bb1-prog/morinolink-governance/main/master_core/GPTs_load_contract.json",
    "governance_charter": "https://raw.githubusercontent.com/yoshi07bb1-prog/morinolink-governance/main/master_core/GPT5Master_personality2.json",
    "master_personality": "https://raw.githubusercontent.com/yoshi07bb1-prog/morinolink-governance/main/master_core/GPT5Master_personality.json",
    "strategy_personality": "https://raw.githubusercontent.com/yoshi07bb1-prog/morinolink-governance/main/strategy_agent/keieisenryaku_personality.json"
  },
  "system_state_sources": {
    "work_progress_latest_json": "M365Returns/OperationRegistry/BuildMemo/MORINOLINK_WORK_PROGRESS_LATEST.json",
    "work_progress_latest_md": "M365Returns/OperationRegistry/BuildMemo/MORINOLINK_WORK_PROGRESS_LATEST.md",
    "owner_cockpit_latest": "M365Returns/OperationRegistry/OwnerCockpit/CURRENT/today_chat_brief.txt",
    "safety_gate_contract": "configs/morinolink_common_safety_gate_schema.json",
    "publication_guard_status": "docs/morinolink_publication_guard_v1.md",
    "operational_mvp_status": "BuildMemo/LATEST verified=true PASS_MORINOLINK_OPERATIONAL_AUTONOMOUS_SYSTEM_WITH_OWNER_GATE_COMPLETED_FINAL"
  },
  "startup_output_required": [
    "load_status_by_layer",
    "current_system_summary",
    "completed_capabilities",
    "unresolved_hold_items",
    "owner_review_waiting",
    "missing_evidence",
    "forbidden_actions",
    "recommended_next_actions",
    "boundary_flags",
    "current_status",
    "m365_return_latest_status",
    "m365_save_route"
  ],
  "forbidden_actions": [
    "AI final decision",
    "finance_update",
    "IntegratedReport update",
    "FullsetCache update",
    "Power Automate production change",
    "Gate3",
    "workflow_dispatch",
    "PDF delete",
    "PDF overwrite"
  ],
  "ai_final_decision": false,
  "full_autonomous_completion": false,
  "final_decision_owner": "島田善信オーナー",
  "current_status": "PASS_MORINOLINK_OPERATIONAL_AUTONOMOUS_SYSTEM_WITH_OWNER_GATE_COMPLETED_FINAL",
  "legacy_statuses": [
    "LIMITED_E2E_COMPLETION"
  ],
  "m365_save_route": {
    "formal_route": "onedrive_sync_path_save",
    "base": "M365Returns",
    "sharepoint_upload_file_adopted": false
  },
  "m365_return_latest_policy": {
    "on_404": "HOLD_M365_RETURN_LATEST_NOT_PUBLISHED",
    "does_not_cancel_operational_completion": true
  },
  "completed_capabilities_evidence": {
    "slack_real_notification": true,
    "teams_real_notice": true,
    "m365_save": true,
    "buildmemo_latest_verified": true
  }
}
